{"schemaVersion":"1.0","observedAt":"2026-09-25T12:34:56.123Z","diagnosticId":"diag0001","correlationId":"ABC123","root":{"severity":"error","code":"SF2003","title":{"key":"diagnostic.datapack","value":"datapack validation failed"},"locations":{"items":[{"id":"datapack","kind":"resource","display":{"value":"world/datapacks/example/data/example/item.json","origin":"external","sensitivity":"server_sensitive","disposition":"generalized","marker":{"category":"PATH"}},"position":{"start":{"line":12,"column":9},"end":{"line":12,"column":28}},"excerpt":{"startLine":12,"lines":{"items":[{"lineNumber":12,"text":{"value":"\"type\": \"minecraft:unknown\"","origin":"generated","sensitivity":"public","disposition":"visible","marker":null}}],"omittedCount":0},"labels":{"items":[{"range":{"start":{"line":12,"column":9},"end":{"line":12,"column":28}},"style":"primary","message":{"value":"unknown registry value","origin":"generated","sensitivity":"public","disposition":"visible","marker":null},"evidenceIds":{"items":["fact"],"omittedCount":0}}],"omittedCount":0}},"evidenceIds":{"items":["fact"],"omittedCount":0}},{"id":"registry","kind":"component","display":{"value":"item registry","origin":"generated","sensitivity":"public","disposition":"visible","marker":null},"position":null,"excerpt":null,"evidenceIds":{"items":["fact"],"omittedCount":0}}],"omittedCount":0},"notes":{"items":[{"kind":"cause","text":{"value":"no registry entry matches \"minecraft:unknown\"","origin":"generated","sensitivity":"public","disposition":"visible","marker":null},"evidenceIds":{"items":["fact"],"omittedCount":0}},{"kind":"context","text":{"value":"validation ran during world loading","origin":"generated","sensitivity":"public","disposition":"visible","marker":null},"evidenceIds":{"items":["fact"],"omittedCount":0}},{"kind":"note","text":{"value":"the datapack was not applied","origin":"generated","sensitivity":"public","disposition":"visible","marker":null},"evidenceIds":{"items":["fact"],"omittedCount":0}}],"omittedCount":0},"help":{"items":[{"text":{"value":"check the identifier and whether its providing mod is installed","origin":"generated","sensitivity":"public","disposition":"visible","marker":null},"kind":"action","evidenceIds":{"items":["fact"],"omittedCount":0}}],"omittedCount":0},"trace":{"state":"preserved","totalFrames":22,"shownFrames":2,"omittedFrames":20,"omittedCauses":1,"destination":{"value":"local diagnostic store","origin":"generated","sensitivity":"public","disposition":"visible","marker":null},"recordId":"record01"},"evidence":{"items":[{"id":"fact","kind":"validated_content","summary":{"value":"validated registry content","origin":"generated","sensitivity":"public","disposition":"visible","marker":null},"source":{"value":"approved datapack source","origin":"generated","sensitivity":"public","disposition":"visible","marker":null}}],"omittedCount":0},"confidence":{"assessmentId":null,"classifierId":null,"evidenceIds":{"items":[],"omittedCount":0},"policyId":null},"children":{"items":[{"relation":"cause","diagnostic":{"severity":"note","code":"SF0001","title":{"key":"diagnostic.decode","value":"registry lookup failed"},"locations":{"items":[],"omittedCount":0},"notes":{"items":[{"kind":"note","text":{"value":"the identifier was preserved in the debug record","origin":"generated","sensitivity":"public","disposition":"visible","marker":null},"evidenceIds":{"items":[],"omittedCount":0}}],"omittedCount":0},"help":{"items":[],"omittedCount":0},"trace":{"state":"not_applicable","totalFrames":null,"shownFrames":0,"omittedFrames":0,"omittedCauses":0,"destination":null,"recordId":null},"evidence":{"items":[],"omittedCount":0},"confidence":{"assessmentId":null,"classifierId":null,"evidenceIds":{"items":[],"omittedCount":0},"policyId":null},"children":{"items":[],"omittedCount":0},"omissions":{"items":[],"omittedCount":0}}}],"omittedCount":0},"omissions":{"items":[],"omittedCount":0}},"redactions":{"items":[{"marker":{"category":"PATH"},"transformation":"generalized","occurrenceCount":1}],"omittedCount":0},"omissions":{"items":[],"omittedCount":0}}
