{"schemaVersion":"1.0","observedAt":"2026-09-25T12:34:56.123Z","diagnosticId":"diag0001","correlationId":"ABC123","root":{"severity":"error","code":"SF0001","title":{"key":"diagnostic.fixture","value":"operation failed"},"locations":{"items":[],"omittedCount":0},"notes":{"items":[],"omittedCount":0},"help":{"items":[],"omittedCount":0},"trace":{"state":"not_applicable","totalFrames":null,"shownFrames":0,"omittedFrames":0,"omittedCauses":0,"destination":null,"recordId":null},"evidence":{"items":[],"omittedCount":0},"confidence":{"assessmentId":null,"classifierId":null,"evidenceIds":{"items":[],"omittedCount":0},"policyId":null},"children":{"items":[],"omittedCount":0},"omissions":{"items":[],"omittedCount":0}},"redactions":{"items":[],"omittedCount":0},"omissions":{"items":[],"omittedCount":0}}
